1,2,3,4,5,6,7,8,9,10,11,12,13,14,15,16,17
Trump names Kavanaugh for US Supreme Court,"Brett Kavanaugh, Trump's Potential Supreme Court Nominee, Is No Friend to Net Neutrality",Trump nominates conservative Kavanaugh to Supreme Court,These senators will make or break Trump's Supreme Court nominee,President Trump Chooses Brett Kavanaugh for Supreme Court Vacancy,Outside Groups Plan Costly Campaigns For—or Against—Supreme Court Nominee Brett Kavanaugh,Who Is Brett Kavanaugh?,Trump picks Brett Kavanaugh for the Supreme Court: NBC News,Trump nominates Brett Kavanaugh to replace the retiring Justice Anthony Kennedy on the Supreme Court,Trump Nominates Brett ­Kavanaugh for the U.S. Supreme Court,Washington insider Kavanaugh boasts conservative credentials,"Kavanaugh Resembles Roberts, But They’re Hardly Clones",What you need to know about Trump’s Supreme Court nominee Brett Kavanaugh,Watch: Trump announces next Supreme Court nominee,Judge Brett Kavanaugh: In His Own Words,Trump picks conservative judge Kavanaugh for Supreme Court,Trump picks conservative Kavanaugh as Supreme Court nominee: NBC
May Fights to Contain Brexit Crisis After Key Ministers Quit,Meet Dominic Raab: the new Brexit boss,Resignations Over May’s Brexit Plan Throw U.K. Government Into Turmoil,Boris Johnson quits as pressure on Theresa May mounts,Theresa May now faces the second Battle of Brexit,PM to meet new cabinet amid Brexit turmoil,,,,,,,,,,,
Factbox: Turkey's new cabinet under powerful executive presidency,Erdogan names son-in-law as finance chief,Erdogan names son-in-law to lead Turkey’s finance ministry,Erdogan Names Son-in-Law as Treasury and Finance Minister,"Turkey's Erdogan sworn in with new powers, names son-in-law finance minister",,,,,,,,,,,,
Thai cave rescue: Divers prepare to resume phase 3  -- live updates,Cave rescue enters day three,Cave divers ready to rescue last five,"Divers Rescue Four More Boys From Thai Cave, Bringing Total to Eight",,,,,,,,,,,,,
Mattis battles to hold line with Trump as Nato summit looms,Trump hits out at Germany ahead of Nato summit,Trump Might Be Right About NATO—but for All the Wrong Reasons,,,,,,,,,,,,,,
"Microsoft Debuts $399 Surface Go Tablet, Taking on Cheaper iPads",Microsoft's $399 Surface Go hits most of the right notes to compete with the iPad and Chromebooks,,,,,,,,,,,,,,,
TD Bank speeds up junior bankers’ promotions to attract and keep young talent,TD Speeds Up Junior Bankers' Promotions to Attract Young Talent,,,,,,,,,,,,,,,
‘I would put money on it’: LNG Canada dreams closer to coming true as Shell ramps up in Kitimat,"Shell Ramps Up in Kitimat, Raising Canada’s $30 Billion LNG Hopes",,,,,,,,,,,,,,,
Judge rejects administration's bid to alter rules on detaining minors,Judge rejects Trump request for long-term detention of immigrant children,,,,,,,,,,,,,,,
UK PM May appoints Jeremy Hunt as new foreign minister,Euroskeptic British ministers quit in blow to May's Brexit plan,,,,,,,,,,,,,,,
Starbucks says goodbye to plastic straws,Starbucks to Eliminate Plastic Straws by 2020,,,,,,,,,,,,,,,
Amazon as a value stock?: Why the $840-billion company’s shares are surprisingly cheap,Amazon is increasingly tying Whole Foods to its Prime service – and it could be the gateway to $1 trillion,,,,,,,,,,,,,,,
Wanted: A Nurse for Fortis Who Won’t Kill It,,,,,,,,,,,,,,,,
Trump Loses Bid to Modify Settlement Over Child Detention,,,,,,,,,,,,,,,,
Alberta Premier Says Province Likely to Buy Trans Mountain Stake,,,,,,,,,,,,,,,,
Bank of Canada’s Expected Hike Is Six Months in Making for Poloz,,,,,,,,,,,,,,,,
"Do not blame OPEC, oil producer group says of Trump criticism",,,,,,,,,,,,,,,,
"Asia shares extend rally, pound bewildered by politics",,,,,,,,,,,,,,,,
Mario Draghi delivers bullish assessment of eurozone prospects,,,,,,,,,,,,,,,,
Apple and Alphabet face US house panel questioning on privacy,,,,,,,,,,,,,,,,
Masayoshi Son seeks to convince world of SoftBank’s true worth,,,,,,,,,,,,,,,,
‘Big four’ paid millions to advise Brussels on tax policy,,,,,,,,,,,,,,,,
London has excellent universities—but unhappy students,,,,,,,,,,,,,,,,
Our second week of essays on transgender identities,,,,,,,,,,,,,,,,
Jean-Louis Tauran opposed the Gulf war and mended fences with Islam,,,,,,,,,,,,,,,,
Why bitcoin uses so much energy,,,,,,,,,,,,,,,,
Boris goes,,,,,,,,,,,,,,,,
A court with a solid conservative majority could reshape American life,,,,,,,,,,,,,,,,
North Korea presents nuclear disarmament’s biggest challenge yet,,,,,,,,,,,,,,,,
Culture and the labour market keep India’s women at home,,,,,,,,,,,,,,,,
Our essay competitions for young people,,,,,,,,,,,,,,,,
Brett Kavanaugh Has Shown Deep Skepticism of Regulatory State,,,,,,,,,,,,,,,,
Former Goldman Banker Is in Plea Talks Over Malaysian 1MDB Scandal,,,,,,,,,,,,,,,,
Billionaire’s Secret Buyout Formula: 110 Instructions and an Intelligence Test,,,,,,,,,,,,,,,,
Trump invited these red-state Democrats to his Supreme Court announcement. They all said no,,,,,,,,,,,,,,,,
"Market rally the ‘last hurrah’ – investors should sell now, warns Guggenheim investment chief",,,,,,,,,,,,,,,,
People are using Fitbits and Apple Watches to monitor their heart rate when binging on drugs — and doctors say it's a bad idea,,,,,,,,,,,,,,,,
Homeowners are sitting on a record amount of cash – and not tapping it,,,,,,,,,,,,,,,,
"US futures climb ahead of the open, as trade turmoil takes a breather",,,,,,,,,,,,,,,,
CSA maps out higher-tech surveillance plan,,,,,,,,,,,,,,,,
"Canadian broadcasting industry shrank in 2017, CRTC reports",,,,,,,,,,,,,,,,
One billion share issuance weighs on Enbridge,,,,,,,,,,,,,,,,
Barrick forges closer ties with Chinese partner in bid to revive South American mine,,,,,,,,,,,,,,,,
Cannabis grower Tilray valued at up to US$1.5 billion for Nasdaq IPO,,,,,,,,,,,,,,,,
"Greyhound Canada to end service in Prairies, B.C., eliminating 415 jobs — and leaving small towns in the lurch",,,,,,,,,,,,,,,,
"American steaks, German cars emerge as early victims in U.S.-China trade war",,,,,,,,,,,,,,,,
BARCLAYS: Here are the 4 biggest risks to the Netflix story (NFLX),,,,,,,,,,,,,,,,
'This next year will ... feel like childbirth': HBO's new corporate overlord warns employees to expect a tough year,,,,,,,,,,,,,,,,
'Those are stupid people': Trump reportedly tried to calm Putin after he complained that White House officials were trying to stop them from speaking,,,,,,,,,,,,,,,,
BANK OF AMERICA: The stock market's most important driver will be more powerful than we'd expected — and one sector towers over the rest,,,,,,,,,,,,,,,,
Expanding Warren Buffett’s value investing approach to the socially responsible sector,,,,,,,,,,,,,,,,
The cruel truth about how much money two founders will likely get after selling their startup for $465 million reveals the catch-22 of raising too much money,,,,,,,,,,,,,,,,
'Either it happens or TV gets decimated': Insiders are split on AT&T's chances of building an ad platform for the entire TV industry,,,,,,,,,,,,,,,,
"A former Facebook moderator says she had to review 8,000 posts a day and it made her numb to child porn",,,,,,,,,,,,,,,,
Telstra says shock departure of network boss Mike Wright won't affect 5G plans,,,,,,,,,,,,,,,,
"Business confidence strong, employment index drops in June: NAB survey",,,,,,,,,,,,,,,,
Lenders blitz borrowers in cut-throat pricing battle to grab market share,,,,,,,,,,,,,,,,
Village Roadshow wants to put Dreamworld disaster behind it with capital raising,,,,,,,,,,,,,,,,
Data helps property investors identify gentrification before it happens,,,,,,,,,,,,,,,,
Markets Live: ASX set to advance on commodities,,,,,,,,,,,,,,,,
All eyes on big four after Macquarie Bank lifts rates,,,,,,,,,,,,,,,,
The biggest risks for property investors (and why you might prefer shares),,,,,,,,,,,,,,,,
Mornington Peninsula lays on its winter best for a cosy weekend escape,,,,,,,,,,,,,,,,
Shares help turn wage slaves into Rich Bosses,,,,,,,,,,,,,,,,
California Prosecutor Put on Leave After Negative Comments About Maxine Waters,,,,,,,,,,,,,,,,
Baby survived 9 hours buried in Montana mountains,,,,,,,,,,,,,,,,
Trump's former personal driver sues over 'exploited' wages,,,,,,,,,,,,,,,,
"Power outages, flooding hits Puerto Rico, USVI amid storms",,,,,,,,,,,,,,,,
"They were zip-lining on their honeymoon when they collided. He died, she was injured",,,,,,,,,,,,,,,,
"El Paso cop pulls gun on group of children, arrests cameraman",,,,,,,,,,,,,,,,
U.S. effort to weaken an international breast-feeding resolution has a long history,,,,,,,,,,,,,,,,
IHOb No More: IHOP Says Its Burger-Rebranding Was Just a Gimmick,,,,,,,,,,,,,,,,
Another Crypto Fail: Hackers Steal $23.5 Million from Token Service Bancor,,,,,,,,,,,,,,,,
This Irish Bill Could Create Huge Problems for U.S. Companies Like Apple,,,,,,,,,,,,,,,,
Mobile Health Apps Get An FDA Push,,,,,,,,,,,,,,,,
"Babies Given Solid Foods Sooner May Sleep Better, Study Shows",,,,,,,,,,,,,,,,
Here’s What the World’s Biggest Investor Thinks the Markets Will Do Next,,,,,,,,,,,,,,,,
Magazine | Fortune,,,,,,,,,,,,,,,,
'Sick' EU ivory sales a 'cover for poaching',,,,,,,,,,,,,,,,
'Whether he is alive or dead is a mystery',,,,,,,,,,,,,,,,
Novichok pair had high dose - police,,,,,,,,,,,,,,,,
Migrant toddlers face US courts alone,,,,,,,,,,,,,,,,
