1,2,3,4,5,6,7,8,9
British PM May appoints Dominic Raab as new Brexit minister,The UK’s Brexit secretary just walked away from the job. Here’s what that means,Factbox: How could Britain's Prime Minister Theresa May be removed from office?,UK government in disarray as Davis resigns as Brexit secretary,"David Davis, U.K. Minister in Charge of Brexit Negotiations, Resigns",Britain’s new Brexit plan is savaged—by its own Brexit secretary,UK Brexit minister Braverman has not resigned in protest: official,"Denouncing 'dangerous strategy', Brexit minister quits in blow to May",EU's Verhofstadt: Brexit talks must move on after UK minister quits
Thai boys in flooded cave wait for rescue mission to restart after first four are freed,Rescuers carry person on stretcher to ambulance from Thai cave: Reuters witness,Four Boys Rescued From Flooded Thai Cave,Operation resumes to rescue boys trapped in flooded Thai cave,Rescue divers have gone back into the Thai caves to rescue the 8 boys still trapped inside,Divers free four boys in Thailand cave rescue,,,
Trump Making Supreme Court Pick to Cement Conservative Majority,A court with a solid conservative majority could reshape American life,Trump Takes a Final Look at Supreme Court Choices,Democrats are tying Trump's Supreme Court pick to the special counsel's Russia probe. Here's why,,,,,
Trudeau Says Nothing ‘Untoward’ Led to Past Groping Allegation,"Canada Strikes Back at Trump, and Condo Buyers Will Pay the Price",Canada should be embarrassed: Trudeau needs to smarten up on defence and pay our share to NATO,,,,,,
CITI: A 'full-on global bear market' is coming — here's where to put your money until it arrives,JPMorgan Maps Out Currencies to Buy If a Recession Is Coming,,,,,,,
North Korea presents nuclear disarmament’s biggest challenge yet,North Korea Reminds Trump Its Nuclear Weapons Won’t Come Cheap,,,,,,,
Shares of Chinese smartphone maker Xiaomi open for trade below IPO price,Chinese Smartphone Maker Xiaomi Falls in Hong Kong Trading Debut,,,,,,,
"Oil is likely to jump another 10 percent this summer, energy expert Tom Kloza predicts",Expect a ripple effect on oil prices: Boots-on-the-ground analyst says Syncrude won’t return to full capacity by August,,,,,,,
Brexit Brouhaha Can't Beat Dollar Weakness,,,,,,,,
Dreams of Goldman Doing Big Takeover Meet Stress Test’s Reality,,,,,,,,
Russia Should Admit It Uses Mercenaries,,,,,,,,
"Canada’s Labor Force Grows Most in 6 Years, Raising Jobless Rate",,,,,,,,
What’s Next for Hotelier After Buying the Trump Toronto? America,,,,,,,,
Global stocks hit two-week high as U.S. jobs report spreads relief,,,,,,,,
Myanmar court presses secrets act charges against Reuters reporters,,,,,,,,
UK woman dies after poisoning by Soviet-era nerve agent,,,,,,,,
Trump-Putin face nuclear options at Helsinki summit,,,,,,,,
‘A good living but a rough life’: trucker shortage holds US economy back,,,,,,,,
US banks count on tax cut windfall to boost profits,,,,,,,,
Apple slices into Spotify’s lead in US music market,,,,,,,,
Italy’s debts to European Central Bank near €500bn,,,,,,,,
BlackRock and Citi plan Paris expansion in Macron coup,,,,,,,,
Yelp’s Jeremy Stoppelman on his Big Tech fightback,,,,,,,,
Explainer: issues at the heart of May’s soft-Brexit Chequers deal,,,,,,,,
Why bitcoin uses so much energy,,,,,,,,
The boss of Pakistan’s ruling party is sentenced to ten years in jail,,,,,,,,
Italy’s government proposes to limit fixed-term job contracts,,,,,,,,
Tomorrow’s squadron leaders will be accompanied by drones,,,,,,,,
Japan is finally starting to admit more foreign workers,,,,,,,,
Culture and the labour market keep India’s women at home,,,,,,,,
Transgender identities: a series of invited essays,,,,,,,,
U.S. Exporters Will Be a Surprise Loser From Tariff Fight,,,,,,,,
Central Banks Try to Bolster Their Currencies. It’s Not Always Working,,,,,,,,
House Money: Wall Street Is Raising More Cash Than Ever for its Rental-Home Gambit,,,,,,,,
Legacy Preferences Complicate Colleges’ Diversity Push,,,,,,,,
"When Three Brothers With a Blood Disorder Lost Their Jobs, the EEOC Sued",,,,,,,,
Summit Looms for a Strained NATO Alliance,,,,,,,,
Chinese tech giant Tencent plans to list its online music business in the United States,,,,,,,,
"Consumer companies, desperate for growth, drove dealmaking to a 15-year high in 2017",,,,,,,,
"Two nominees are now Trump's greatest focus for top court, NBC News says",,,,,,,,
"Energy, technology sectors may put up blowout numbers when earnings season kicks off",,,,,,,,
Cramer's game plan: Earnings will determine a winner in the market's bull-bear battle,,,,,,,,
Why Poloz should pull the trigger on another rate hike,,,,,,,,
Can Laurent Troger keep Bombardier’s rail division on the right track?,,,,,,,,
"‘Tsunami-like’ downturn: Autos tariffs could raise vehicle prices in Canada by $9,000",,,,,,,,
Don’t be like Johnny. Don’t go broke with $650 million,,,,,,,,
Lithium is exploding but Canada’s distance from China has miners at a disadvantage,,,,,,,,
"‘We are fighting against the system’: A $5.2-billion pipeline in Italy is being held up by 1,600 olive trees",,,,,,,,
"Woman juggling $500,000 in debts, less than $200,000 net worth fears she’s doomed to bleak retirement",,,,,,,,
Five reasons the TSX is underperforming — again,,,,,,,,
Robin Wright finally spoke about Kevin Spacey: 'I didn't know the man',,,,,,,,
Google cofounder Sergey Brin went sailing in Ibiza with one of tech's most controversial figures,,,,,,,,
"Amazon's biggest strength is sometimes its weakness, says CEO who built $1 billion business while competing against Amazon",,,,,,,,
There's a mountain of evidence that Trump's trade fights will be most harmful to the people who voted for him,,,,,,,,
"Wall Street rejoices as Dell decides to leave VMware as an independent company, ending months of fear and doubt",,,,,,,,
"People love Sonos speakers so much they buy them again and again, but there are 2 big dealbreakers that could spoil its IPO",,,,,,,,
"'Sorry to Bother You' is right — minorities are judged by the sound of their voice, and there's science to prove it",,,,,,,,
Super-Earths are real and they could be an even better place for life than Earth,,,,,,,,
Deputy PM Michael McCormack warns MPs against killing off NEG over coal demands,,,,,,,,
Monopolistic airports face price caps: Productivity Commission,,,,,,,,
"ASX starts the week higher, shrugging off tariff concerns",,,,,,,,
"China needs the global trade order, even if Donald Trump does not",,,,,,,,
Legal start-up LawPath bags investment from US giant as growth rate soars,,,,,,,,
James Packer resigns from Consolidated Press Holdings family board,,,,,,,,
"NAB, Bupa and KPMG force staff off sugar",,,,,,,,
Credit cards on the decline as Visa says we have passed 'peak plastic',,,,,,,,
Want a Tour de France-level bike? Here's what it will cost you.,,,,,,,,
Andrew Brown's hedge fund East 72 and the global hunt for value,,,,,,,,
