1,2,3,4,5,6,7,8,9,10,11,12,13,14,15,16,17,18,19,20,21,22
Judge Brett Kavanaugh: In His Own Words,President Trump Chooses Brett Kavanaugh for Supreme Court Vacancy,Trump picks conservative Kavanaugh as Supreme Court nominee: NBC,Who Is Brett Kavanaugh?,Trump picks conservative judge Kavanaugh for Supreme Court,Trump picks Brett Kavanaugh for the Supreme Court: NBC News,"Trump’s Pick Brett Kavanaugh to Keep Republican-Appointed Majority on Supreme Court, 48 Years Running",Trump Nominates Brett ­Kavanaugh for the U.S. Supreme Court,Trump names Kavanaugh for US Supreme Court,The Test for Judge Kavanaugh,"Brett Kavanaugh, Trump's Potential Supreme Court Nominee, Is No Friend to Net Neutrality","Kavanaugh Resembles Roberts, But They’re Hardly Clones",Outside Groups Plan Costly Campaigns For—or Against—Supreme Court Nominee Brett Kavanaugh,Brett Kavanaugh Has Shown Deep Skepticism of Regulatory State,Donald Trump’s court pick is a Republican stalwart,Brett Kavanaugh is nominated by Trump to succeed Supreme Court Justice Anthony M. Kennedy,What you need to know about Trump’s Supreme Court nominee Brett Kavanaugh,Watch: Trump announces next Supreme Court nominee,Trump nominates Brett Kavanaugh to replace the retiring Justice Anthony Kennedy on the Supreme Court,The conservative legal village that raised Brett Kavanaugh,Washington insider Kavanaugh boasts conservative credentials,Trump nominates conservative Kavanaugh to Supreme Court
Resignations Over May’s Brexit Plan Throw U.K. Government Into Turmoil,Boris Johnson quits as pressure on Theresa May mounts,Meet Dominic Raab: the new Brexit boss,PM to meet new cabinet amid Brexit turmoil,Theresa May now faces the second Battle of Brexit,May Fights to Contain Brexit Crisis After Key Ministers Quit,Boris goes,,,,,,,,,,,,,,,
"Divers Rescue Four More Boys From Thai Cave, Bringing Total to Eight",Cave divers ready to rescue last five,Thai cave rescue: Divers prepare to resume phase 3  -- live updates,Rescuers gear up for final push to save remaining five from Thai cave,Cave rescue enters day three,,,,,,,,,,,,,,,,,
"Turkey's Erdogan sworn in with new powers, names son-in-law finance minister",Factbox: Turkey's new cabinet under powerful executive presidency,Erdogan names son-in-law to lead Turkey’s finance ministry,,,,,,,,,,,,,,,,,,,
Starbucks says goodbye to plastic straws,"Companies are ditching plastic straws, but its alternative will cost you",Starbucks to Eliminate Plastic Straws by 2020,,,,,,,,,,,,,,,,,,,
Microsoft's $399 Surface Go hits most of the right notes to compete with the iPad and Chromebooks,"Microsoft Debuts $399 Surface Go Tablet, Taking on Cheaper iPads",,,,,,,,,,,,,,,,,,,,
TD Bank speeds up junior bankers’ promotions to attract and keep young talent,TD Speeds Up Junior Bankers' Promotions to Attract Young Talent,,,,,,,,,,,,,,,,,,,,
‘I would put money on it’: LNG Canada dreams closer to coming true as Shell ramps up in Kitimat,"Shell Ramps Up in Kitimat, Raising Canada’s $30 Billion LNG Hopes",,,,,,,,,,,,,,,,,,,,
Uighur children fall victim to China anti-terror drive,More than 50 separated children to be reunited with parents Tuesday,,,,,,,,,,,,,,,,,,,,
Trump hits out at Germany ahead of Nato summit,Trump Might Be Right About NATO—but for All the Wrong Reasons,,,,,,,,,,,,,,,,,,,,
Amazon as a value stock?: Why the $840-billion company’s shares are surprisingly cheap,Amazon is increasingly tying Whole Foods to its Prime service – and it could be the gateway to $1 trillion,,,,,,,,,,,,,,,,,,,,
A U.S. Recession Indicator Flashes Red for Leuthold's Paulsen,,,,,,,,,,,,,,,,,,,,,
Trump Loses Bid to Modify Settlement Over Child Detention,,,,,,,,,,,,,,,,,,,,,
Alberta Premier Says Province Likely to Buy Trans Mountain Stake,,,,,,,,,,,,,,,,,,,,,
Bank of Canada’s Expected Hike Is Six Months in Making for Poloz,,,,,,,,,,,,,,,,,,,,,
"Asia shares rise for a third day, pound bewildered by politics",,,,,,,,,,,,,,,,,,,,,
Judge rejects Trump request for long-term detention of immigrant children,,,,,,,,,,,,,,,,,,,,,
"Do not blame OPEC, oil producer group says of Trump criticism",,,,,,,,,,,,,,,,,,,,,
Euroskeptic British ministers quit in blow to May's Brexit plan,,,,,,,,,,,,,,,,,,,,,
China’s Belt and Road difficulties are proliferating across the world,,,,,,,,,,,,,,,,,,,,,
Masayoshi Son seeks to convince world of SoftBank’s true worth,,,,,,,,,,,,,,,,,,,,,
‘Big four’ paid millions to advise Brussels on tax policy,,,,,,,,,,,,,,,,,,,,,
London has excellent universities—but unhappy students,,,,,,,,,,,,,,,,,,,,,
Our second week of essays on transgender identities,,,,,,,,,,,,,,,,,,,,,
Jean-Louis Tauran opposed the Gulf war and mended fences with Islam,,,,,,,,,,,,,,,,,,,,,
Why bitcoin uses so much energy,,,,,,,,,,,,,,,,,,,,,
A court with a solid conservative majority could reshape American life,,,,,,,,,,,,,,,,,,,,,
North Korea presents nuclear disarmament’s biggest challenge yet,,,,,,,,,,,,,,,,,,,,,
Culture and the labour market keep India’s women at home,,,,,,,,,,,,,,,,,,,,,
Our essay competitions for young people,,,,,,,,,,,,,,,,,,,,,
Former Goldman Banker Is in Plea Talks Over Malaysian 1MDB Scandal,,,,,,,,,,,,,,,,,,,,,
Trump invited these red-state Democrats to his Supreme Court announcement. They all said no,,,,,,,,,,,,,,,,,,,,,
People are using Fitbits and Apple Watches to monitor their heart rate when binging on drugs — and doctors say it's a bad idea,,,,,,,,,,,,,,,,,,,,,
These senators will make or break Trump's Supreme Court nominee,,,,,,,,,,,,,,,,,,,,,
"US futures climb ahead of the open, as trade turmoil takes a breather",,,,,,,,,,,,,,,,,,,,,
CSA maps out higher-tech surveillance plan,,,,,,,,,,,,,,,,,,,,,
"Canadian broadcasting industry shrank in 2017, CRTC reports",,,,,,,,,,,,,,,,,,,,,
One billion share issuance weighs on Enbridge,,,,,,,,,,,,,,,,,,,,,
Barrick forges closer ties with Chinese partner in bid to revive South American mine,,,,,,,,,,,,,,,,,,,,,
Cannabis grower Tilray valued at up to US$1.5 billion for Nasdaq IPO,,,,,,,,,,,,,,,,,,,,,
"Greyhound Canada to end service in Prairies, B.C., eliminating 415 jobs — and leaving small towns in the lurch",,,,,,,,,,,,,,,,,,,,,
"American steaks, German cars emerge as early victims in U.S.-China trade war",,,,,,,,,,,,,,,,,,,,,
BARCLAYS: Here are the 4 biggest risks to the Netflix story (NFLX),,,,,,,,,,,,,,,,,,,,,
'This next year will ... feel like childbirth': HBO's new corporate overlord warns employees to expect a tough year,,,,,,,,,,,,,,,,,,,,,
Trump's Supreme Court pick weighed in on 2 thorny issues that could be pertinent to the president,,,,,,,,,,,,,,,,,,,,,
BANK OF AMERICA: The stock market's most important driver will be more powerful than we'd expected — and one sector towers over the rest,,,,,,,,,,,,,,,,,,,,,
Expanding Warren Buffett’s value investing approach to the socially responsible sector,,,,,,,,,,,,,,,,,,,,,
The cruel truth about how much money two founders will likely get after selling their startup for $465 million reveals the catch-22 of raising too much money,,,,,,,,,,,,,,,,,,,,,
'Either it happens or TV gets decimated': Insiders are split on AT&T's chances of building an ad platform for the entire TV industry,,,,,,,,,,,,,,,,,,,,,
"A former Facebook moderator says she had to review 8,000 posts a day and it made her numb to child porn",,,,,,,,,,,,,,,,,,,,,
Telstra says shock departure of network boss Mike Wright won't affect 5G plans,,,,,,,,,,,,,,,,,,,,,
Lenders blitz borrowers in cut-throat pricing battle to grab market share,,,,,,,,,,,,,,,,,,,,,
Village Roadshow wants to put Dreamworld disaster behind it with capital raising,,,,,,,,,,,,,,,,,,,,,
Data helps property investors identify gentrification before it happens,,,,,,,,,,,,,,,,,,,,,
Markets Live: ASX set to advance on commodities,,,,,,,,,,,,,,,,,,,,,
All eyes on big four after Macquarie Bank lifts rates,,,,,,,,,,,,,,,,,,,,,
The biggest risks for property investors (and why you might prefer shares),,,,,,,,,,,,,,,,,,,,,
Mornington Peninsula lays on its winter best for a cosy weekend escape,,,,,,,,,,,,,,,,,,,,,
Shares help turn wage slaves into Rich Bosses,,,,,,,,,,,,,,,,,,,,,
Prosecutor who reportedly suggested Maxine Waters be shot is placed on leave,,,,,,,,,,,,,,,,,,,,,
Baby survived 9 hours buried in Montana mountains,,,,,,,,,,,,,,,,,,,,,
"El Paso cop pulls gun on group of children, arrests cameraman",,,,,,,,,,,,,,,,,,,,,
"Elderly Hispanic man bashed with brick, told 'go back to your country'",,,,,,,,,,,,,,,,,,,,,
U.S. effort to weaken an international breast-feeding resolution has a long history,,,,,,,,,,,,,,,,,,,,,
"Tourists on honeymoon collide while zip-lining, leaving husband dead and wife injured",,,,,,,,,,,,,,,,,,,,,
IHOb No More: IHOP Says Its Burger-Rebranding Was Just a Gimmick,,,,,,,,,,,,,,,,,,,,,
Another Crypto Fail: Hackers Steal $23.5 Million from Token Service Bancor,,,,,,,,,,,,,,,,,,,,,
This Irish Bill Could Create Huge Problems for U.S. Companies Like Apple,,,,,,,,,,,,,,,,,,,,,
Mobile Health Apps Get An FDA Push,,,,,,,,,,,,,,,,,,,,,
"Babies Given Solid Foods Sooner May Sleep Better, Study Shows",,,,,,,,,,,,,,,,,,,,,
Here’s What the World’s Biggest Investor Thinks the Markets Will Do Next,,,,,,,,,,,,,,,,,,,,,
Magazine | Fortune,,,,,,,,,,,,,,,,,,,,,
At least 126 dead as heavy rains hit Japan,,,,,,,,,,,,,,,,,,,,,
'Sick' EU ivory sales a 'cover for poaching',,,,,,,,,,,,,,,,,,,,,
'Whether he is alive or dead is a mystery',,,,,,,,,,,,,,,,,,,,,
Novichok pair had high dose - police,,,,,,,,,,,,,,,,,,,,,
Migrant toddlers face US courts alone,,,,,,,,,,,,,,,,,,,,,
