1,2,3,4,5,6,7,8,9,10
Britain’s new Brexit plan is savaged—by its own Brexit secretary,Factbox: How could Britain's Prime Minister Theresa May be removed from office?,"Denouncing 'dangerous strategy', Brexit minister quits in blow to May",UK Brexit minister Braverman has not resigned in protest: official,UK's ex-Brexit minister Davis says not calling for other resignations,UK government in disarray as Davis resigns as Brexit secretary,The UK’s Brexit secretary just walked away from the job. Here’s what that means,U.K. Minister in Charge of Brexit Negotiations Resigns,UK PM May should not face a leadership challenge: ex-Brexit minister Davis,EU's Verhofstadt: Brexit talks must move on after UK minister quits
Trump Takes a Final Look at Supreme Court Choices,A court with a solid conservative majority could reshape American life,Democrats are tying Trump's Supreme Court pick to the special counsel's Russia probe. Here's why,Trump Making Supreme Court Pick to Cement Conservative Majority,,,,,,
Thai boys in flooded cave wait for rescue mission to restart after first four are freed,Operation resumes to rescue boys trapped in flooded Thai cave,Operation to rescue boys trapped in Thai cave resumes: officials,Four Boys Rescued From Flooded Thai Cave,,,,,,
North Korea presents nuclear disarmament’s biggest challenge yet,North Korea Reminds Trump Its Nuclear Weapons Won’t Come Cheap,,,,,,,,
Shares of Chinese smartphone maker Xiaomi open for trade below IPO price,Chinese Smartphone Maker Xiaomi Falls in Hong Kong Trading Debut,,,,,,,,
"For China, Tech Giant Tencent Is Both a National Champion and a Threat",Chinese tech giant Tencent plans to list its online music business in the United States,,,,,,,,
Russia Should Admit It Uses Mercenaries,,,,,,,,,
Here's One Area Where Russia Beats the U.S.,,,,,,,,,
World Bank CEO Adds to Voices of Worry Over Global Debt Pileup,,,,,,,,,
JPMorgan Maps Out Currencies to Buy If a Recession Is Coming,,,,,,,,,
"Canada’s Labor Force Grows Most in 6 Years, Raising Jobless Rate",,,,,,,,,
What’s Next for Hotelier After Buying the Trump Toronto? America,,,,,,,,,
Trudeau Says Nothing ‘Untoward’ Led to Past Groping Allegation,,,,,,,,,
"Canada Strikes Back at Trump, and Condo Buyers Will Pay the Price",,,,,,,,,
Global stocks hit two-week high as U.S. jobs report spreads relief,,,,,,,,,
Myanmar court presses secrets act charges against Reuters reporters,,,,,,,,,
Trump-Putin face nuclear options at Helsinki summit,,,,,,,,,
‘A good living but a rough life’: trucker shortage holds US economy back,,,,,,,,,
US banks count on tax cut windfall to boost profits,,,,,,,,,
Apple slices into Spotify’s lead in US music market,,,,,,,,,
Japan is nervous about its energy security,,,,,,,,,
Italy’s debts to European Central Bank near €500bn,,,,,,,,,
BlackRock and Citi plan Paris expansion in Macron coup,,,,,,,,,
Yelp’s Jeremy Stoppelman on his Big Tech fightback,,,,,,,,,
Explainer: issues at the heart of May’s soft-Brexit Chequers deal,,,,,,,,,
Why bitcoin uses so much energy,,,,,,,,,
The boss of Pakistan’s ruling party is sentenced to ten years in jail,,,,,,,,,
Italy’s government proposes to limit fixed-term job contracts,,,,,,,,,
Tomorrow’s squadron leaders will be accompanied by drones,,,,,,,,,
Japan is finally starting to admit more foreign workers,,,,,,,,,
Culture and the labour market keep India’s women at home,,,,,,,,,
Transgender identities: a series of invited essays,,,,,,,,,
U.K. Opens Murder Probe After Woman Exposed to Nerve Agent Dies,,,,,,,,,
Summit Looms for a Strained NATO Alliance,,,,,,,,,
"Stock Buybacks Are Booming, but Share Prices Aren’t Budging",,,,,,,,,
How U.S. and China Tariffs Are Rippling Through U.S. Industries,,,,,,,,,
Miss America Organization Split by #MeToo Era Swimsuit Decision,,,,,,,,,
"Consumer companies, desperate for growth, drove dealmaking to a 15-year high in 2017",,,,,,,,,
"The US is facing soaring trade deficits, but rising energy prices are a bigger danger",,,,,,,,,
"Two nominees are now Trump's greatest focus for top court, NBC News says",,,,,,,,,
"Oil is likely to jump another 10 percent this summer, energy expert Tom Kloza predicts",,,,,,,,,
"Energy, technology sectors may put up blowout numbers when earnings season kicks off",,,,,,,,,
